name_pre_v20,name_post_v20,name_NIMH_renamed,question_ML,question_ NIMH ,new,practically_identical,mergeable,notes
Daily5a,day-prescribed-medication-conditions,,For which of the following conditions?,For which of the following conditions?,0,1,1,"in the ML version, choices are stored as an array, in the NIMH version, each choice are stored as a new 0,1 variable with the name of the choice appended to the question name"
Daily6,day-period,,**FEMALES (ages 12-50)** Are you currently having your menstrual period?,Are you currently having your period?,0,1,1,
Daily7,day-lethargic,,"Did you feel like you had **no physical energy**, as if you were **weighted down** or had a **heavy feeling in your arms or legs** for most of the day?","Did you feel like you had no physical energy, as if you were weighted down or had a heavy feeling in your arms and legs for most of the day?",0,1,1,
Daily8,day-cold-cough-flu,,"Do you have a **cold**, **cough**, or **flu** today?","Do you have a cold, cough, or flu today?",1,,,question was added by NIMH group
Daily9,day-problem-categories,,Did you have any of the **following problems** today?,Did you have any of the following problems today?,0,1,1,"in the ML version, choices are stored as an array, in the NIMH version, each choice are stored as a new 0,1 variable with the name of the choice appended to the question name"
Daily9a,day-problems-allergies,,How much did your **allergies** bother you today?,How much did your allergies bother you today?,0,1,1,
Daily9b,day-problems-breath,,How much did your **asthma or respiratory difficulties** bother you today?,How much did your asthma or respiratory difficulties bother you today?,0,1,1,
Daily9c,day-problems-belly-symptoms,,Which (if any) of the following **gastro-intestinal/stomach** symptoms did you have today?,Which (if any) of the following gastro-intestinal/stomach symptoms did you have today?,0,1,1,
Daily9d,day-problems-belly,,How much did this (or these) **gastro-intestinal/stomach** symptom(s) bother you today?,How much did this (or these) gastro-intestinal/stomach symptom(s) bother you today?,0,1,1,
Daily9e,day-problems-muscle,,How much did your **muscle/joint pain** bother you today?,How much did your muscle/joint pain bother you today?,0,1,1,
Daily9f,day-problems-heart,,How much did your **heart racing or pounding** bother you today?,How much did your heart racing or pounding bother you today?,0,1,1,
Daily9g,diziness-situation,,"Did these feelings of **dizziness** occur in a particular situation (in a bus, in hot weather, or other condition)?","Did these feelings occur in a particular situation (in a bus, in hot weather, or other condition)?",0,1,1,"In the ML version, the phrase 'of dizziness' was added and 'diziness-instructions' removed"
Daily9h,diziness-faint,,Did you actually **faint** today?,Did you actually faint today?,0,1,1,
Daily9i,day-headache-duration,,"If you reported a headache present at any questionnaire today, how many **hours did the headache(s) last in total**?",,1,,,question was added by NIMH group
Internet_ev1,internet-use-duration,,**How many hours** did you spend on the **internet** today?,,1,,,question was added by CMI group
Internet_ev1a,internet-use-category,,**What** did you use the **internet** for today?,,1,,,question was added by CMI group
Internet_ev1b,internet-use-location,,**Where** did you use the **internet**?,,1,,,question was added by CMI group
Internet_ev2,friends-communication-method,,What is the **main way** you communicated with your friends today?,,1,,,question was added by CMI group
Internet_ev3,socialmedia-duration,,**How many hours** did you spend on **social media** today?,,1,,,question was added by CMI group